{
  "id": "01JQ8Z5K3M7P0RSTVWXYZ0A1BA",
  "compare_set_id": "01JQ8Z5K3M7P0RSTVWXYZ0A1B2",
  "before_frame_id": "01JQ8Z5K3M7P0RSTVWXYZ0A1B8",
  "after_frame_id": "01JQ8Z5K3M7P0RSTVWXYZ0A1B9",
  "status": "changed",
  "match_method": "number",
  "score": 1,
  "sort_key": "A-101",
  "change_count": 2,
  "minor_count": 1,
  "cluster_count": 1,
  "compare_dxf_path": "/Users/dm/현장/한강자이/.halo/compare/01JQ8Z5K3M7P0RSTVWXYZ0A1BA/compare.dxf",
  "clusters_json_path": "/Users/dm/현장/한강자이/.halo/compare/01JQ8Z5K3M7P0RSTVWXYZ0A1BA/clusters.json",
  "warnings": [],
  "before_frame": {
    "id": "01JQ8Z5K3M7P0RSTVWXYZ0A1B8",
    "compare_set_id": "01JQ8Z5K3M7P0RSTVWXYZ0A1B2",
    "role": "before",
    "file_id": "01JQ8Z5K3M7P0RSTVWXYZ0A1B6",
    "kind": "titleblock",
    "titleblock_handle": "1F3",
    "block_name": "TITLE_A1",
    "bbox": [0, 0, 84100, 59400],
    "sheet_no": "A-101",
    "sheet_title": "3층 평면도",
    "scale_text": "1:100",
    "scale_denominator": 100,
    "date_text": "2026-07-02",
    "norm_key": "A-101",
    "sort_index": 0,
    "provenance": {
      "file": "01JQ8Z5K3M7P0RSTVWXYZ0A1B6",
      "handle": "1F3",
      "path": [],
      "space": "MODEL"
    },
    "attributes": null
  },
  "after_frame": {
    "id": "01JQ8Z5K3M7P0RSTVWXYZ0A1B9",
    "compare_set_id": "01JQ8Z5K3M7P0RSTVWXYZ0A1B2",
    "role": "after",
    "file_id": "01JQ8Z5K3M7P0RSTVWXYZ0A1B7",
    "kind": "titleblock",
    "titleblock_handle": "1F3",
    "block_name": "TITLE_A1",
    "bbox": [0, 0, 84100, 59400],
    "sheet_no": "A-101",
    "sheet_title": "3층 평면도",
    "scale_text": "1:100",
    "scale_denominator": 100,
    "date_text": "2026-08-20",
    "norm_key": "A-101",
    "sort_index": 0,
    "provenance": {
      "file": "01JQ8Z5K3M7P0RSTVWXYZ0A1B7",
      "handle": "1F3",
      "path": [],
      "space": "MODEL"
    },
    "attributes": null
  }
}
